{
  "authority": "independent-host-allowlist-required",
  "id": "flowblind-catalog-research-v2-verifier-release-v1",
  "liveImageManifestDigests": {
    "prepare": "REQUIRED_BEFORE_LIVE_ACTIVATION",
    "run": "REQUIRED_BEFORE_LIVE_ACTIVATION"
  },
  "lock": {
    "byteLength": 16667,
    "reference": "runtime/generated/data/flowblind-catalog-research-v2-package-lock-v1.json",
    "sha256": "64f7fbfd042fac543e6d097838b2c4fa2cd28ce7a9fbbb4f05d691807bc29086"
  },
  "packageId": "flowblind-research-teammate-v2",
  "packageVersion": "2.0.0",
  "schemaVersion": 1,
  "verifier": {
    "byteLength": 36769,
    "reference": "runtime/flowblind-research-teammate-verification-v2.js",
    "sha256": "8050fb71b8f50be40ca2e1dd0e92f0aab0f63efc39067512d2221cbead58bcac"
  }
}
